{
  "$schema": "https://json-schema.org/draft/2020-12/schema",
  "title": "Груз",
  "type": "object",
  "description": "Объект системы, содержащий информацию о перевозимом грузе.",


  "required": [
    "num",
    "desc",
    "amount",
    "weight",
    "package",
    "owner"
  ],
  "examples": [
  {
    "num": "Груз-001",
    "desc": "Электроника",
    "amount": 10,
    "weight": 50,
    "volume": 0.5,
    "package": "Коробка",
    "owner": {
      "host": "example.com",
      "id": "123e4567-e89b-12d3-a456-426614174000",
      "entity": "item"
    }
  },
  {
    "num": "Груз-002",
    "desc": "Товары народного потребления",
    "amount": 20,
    "weight": 100,
    "volume": 1.2,
    "package": "Паллет",
    "owner": {
      "host": "example.com",
      "id": "123e4567-e89b-12d3-a456-426614174001",
      "entity": "item"
    }
  },
  {
    "num": "Груз-003",
    "desc": "Стройматериалы",
    "amount": 5,
    "weight": 200,
    "volume": 2.5,
    "package": "Биг-бэг",
    "owner": {
      "host": "example.com",
      "id": "123e4567-e89b-12d3-a456-426614174002",
      "entity": "item"
    }
  },
  {
    "num": "Груз-004",
    "desc": "Мебель",
    "amount": 3,
    "weight": 150,
    "volume": 1.8,
    "package": "Коробка",
    "owner": {
      "host": "example.com",
      "id": "123e4567-e89b-12d3-a456-426614174003",
      "entity": "item"
    }
  },
  {
    "num": "Груз-005",
    "desc": "Автомобильные запчасти",
    "amount": 15,
    "weight": 75,
    "volume": 0.8,
    "package": "Паллет",
    "owner": {
      "host": "example.com",
      "id": "123e4567-e89b-12d3-a456-426614174004",
      "entity": "item"
    }
  },
  {
    "num": "Груз-006",
    "desc": "Продукты питания",
    "amount": 10,
    "weight": 30,
    "volume": 0.3,
    "package": "Коробка",
    "owner": {
      "host": "example.com",
      "id": "123e4567-e89b-12d3-a456-426614174005",
      "entity": "item"
    }
  },
  {
    "num": "Груз-007",
    "desc": "Химические вещества",
    "amount": 5,
    "weight": 100,
    "volume": 1.5,
    "package": "Биг-бэг",
    "owner": {
      "host": "example.com",
      "id": "123e4567-e89b-12d3-a456-426614174006",
      "entity": "item"
    }
  },
  {
    "num": "Груз-008",
    "desc": "Электрическое оборудование",
    "amount": 8,
    "weight": 120,
    "volume": 1.2,
    "package": "Паллет",
    "owner": {
      "host": "example.com",
      "id": "123e4567-e89b-12d3-a456-426614174007",
      "entity": "item"
    }
  },
  {
    "num": "Груз-009",
    "desc": "Лекарственные препараты",
    "amount": 2,
    "weight": 20,
    "volume": 0.2,
    "package": "Коробка",
    "owner": {
      "host": "example.com",
      "id": "123e4567-e89b-12d3-a456-426614174008",
      "entity": "item"
    }
  }],
  "properties": {
    "num": {
      "type": "string",
      "description": "Идентификатор грузовой единицы"
    },
    "desc": {
      "type": "string",
      "description": "Текстовое описание груза"
    },
    "amount": {
      "type": "integer",
      "minimum": 1,
      "default": 1,
      "description": "Количество груза в единицах измерения (штуки)"
    },
    "weight": {
      "type": "integer",
      "minimum": 1,
      "description": "Суммарный вес груза в килограммах вместе с упаковкой (брутто)"
    },
    "volume": {
      "type": "number",
      "format": "float",
      "exclusiveMinimum": 0,
      "description": "Объем груза в метрах кубических. Вещественное число с тремя знаками после запятой."
    },
    "package": {
      "type": "string",
      "description": "Сведения об упаковке груза"
    },
    "owner": {
      "description": "Контрагент, являющийся владельцем перевозимого груза",
      "oneOf": [
        {
          "$ref": "../props/link.json"
        },
        {
          "$ref": "./contractor-item.json"
        }
      ]
    }
  }
}