[
  {
    "num": "5ZMqzXS9I7J7oUQ",
    "desc": "SqN4P0P",
    "amount": 312,
    "weight": 144,
    "volume": 349.7,
    "package": "rRjAaT",
    "owner": {
      "error": "Unable to resolve reference: ../props/link.json"
    }
  },
  {
    "num": "sX4ea4z7PH",
    "desc": "rCiAKM9UOROU1c",
    "amount": 67,
    "weight": 976,
    "volume": 934.7,
    "package": "LRJzzsJVvJtgKvZf",
    "owner": {
      "error": "Unable to resolve reference: ../props/link.json"
    }
  },
  {
    "num": "at5CYDeX8Uz",
    "desc": "zYNb7uyraeakVEK",
    "amount": 949,
    "weight": 74,
    "volume": 497.14,
    "package": "zTkcRtECseac",
    "owner": {
      "error": "Unable to resolve reference: ../props/link.json"
    }
  },
  {
    "num": "IC1ZUXgDxc",
    "desc": "bg28Nl",
    "amount": 259,
    "weight": 118,
    "volume": 121.58,
    "package": "TiXQvn",
    "owner": {
      "error": "Unable to resolve reference: ./contractor-item.json"
    }
  },
  {
    "num": "PgOR5qnpb6r5ekWvf9",
    "desc": "m1UxdZOqoAEV7",
    "amount": 747,
    "weight": 187,
    "volume": 273.81,
    "package": "KSJVmx",
    "owner": {
      "error": "Unable to resolve reference: ../props/link.json"
    }
  },
  {
    "num": "XrljuxXxnUufB3O",
    "desc": "CKMv43",
    "amount": 417,
    "weight": 338,
    "volume": 401.12,
    "package": "kY8jubUUxVtYVTc0",
    "owner": {
      "error": "Unable to resolve reference: ./contractor-item.json"
    }
  },
  {
    "num": "AEHlJvubVLzP",
    "desc": "9H1ti8qAEq",
    "amount": 839,
    "weight": 797,
    "volume": 639.93,
    "package": "6TNEiyNYXB2G",
    "owner": {
      "error": "Unable to resolve reference: ../props/link.json"
    }
  },
  {
    "num": "iEpoe5Lt9DTH3",
    "desc": "jAsMALg",
    "amount": 24,
    "weight": 769,
    "volume": 517.0,
    "package": "w380772pRjy",
    "owner": {
      "error": "Unable to resolve reference: ./contractor-item.json"
    }
  },
  {
    "num": "BIaorlZg3JEwVX1Kx8",
    "desc": "hgcGm",
    "amount": 421,
    "weight": 416,
    "volume": 345.03,
    "package": "IjK5dFJx8gbiL",
    "owner": {
      "error": "Unable to resolve reference: ../props/link.json"
    }
  },
  {
    "num": "9ylTcxXA5NNs",
    "desc": "4cBIWkp5nrv",
    "amount": 83,
    "weight": 557,
    "volume": 176.89,
    "package": "0RD0EuUoqUVKmX",
    "owner": {
      "error": "Unable to resolve reference: ../props/link.json"
    }
  }
]